{
  "schemaVersion": 1,
  "runId": "14810-1793081776283004964",
  "baseline": {
    "protocol": 1,
    "runId": "14810-1793081776283004964",
    "jobId": "baseline",
    "generation": 0,
    "outcome": "passed",
    "tests": {
      "passed": 2,
      "failed": 0,
      "skipped": 0
    },
    "errors": [],
    "coverage": {
      "complete": true,
      "tests": [
        {
          "id": "785083164_0",
          "file": "/root/oximut/.oximut/cache-scan-invalidation/measured-01-m1-oximut-incremental-source/project/test/subject.test.ts",
          "name": "enables the feature"
        },
        {
          "id": "785083164_1",
          "file": "/root/oximut/.oximut/cache-scan-invalidation/measured-01-m1-oximut-incremental-source/project/test/subject.test.ts",
          "name": "excludes the exact limit"
        }
      ],
      "hits": [
        {
          "mutantId": "fc1599c4b0bb153a811ae53c50780024f29b0c571cd7108e189d9a52a86836bf",
          "tests": [
            "785083164_0"
          ],
          "outsideTest": false
        },
        {
          "mutantId": "6309dd52344d80f767c0d6fb3b95865c1eb63e05bd6e1ad341450de03b8d7675",
          "tests": [
            "785083164_1"
          ],
          "outsideTest": false
        },
        {
          "mutantId": "09e8f31b7ce318ba2093f75696585313846b37eb9f80f4b43d065cdb613efbdc",
          "tests": [],
          "outsideTest": false
        }
      ],
      "reasons": []
    }
  },
  "mutants": [
    {
      "id": "6309dd52344d80f767c0d6fb3b95865c1eb63e05bd6e1ad341450de03b8d7675",
      "file": "/root/oximut/.oximut/cache-scan-invalidation/measured-01-m1-oximut-incremental-source/project/src/subject.ts",
      "operator": "comparison-boundary",
      "original": "<",
      "replacement": "<=",
      "location": {
        "start": {
          "offset": 123,
          "line": 6,
          "column": 16
        },
        "end": {
          "offset": 124,
          "line": 6,
          "column": 17
        }
      },
      "outcome": "killed",
      "tests": {
        "passed": 1,
        "failed": 1,
        "skipped": 0
      },
      "errors": [
        "expected true to be false // Object.is equality"
      ],
      "selection": {
        "mode": "files",
        "files": [
          "/root/oximut/.oximut/cache-scan-invalidation/measured-01-m1-oximut-incremental-source/project/test/subject.test.ts"
        ],
        "selectedTests": 2,
        "totalTests": 2,
        "expectedSkipped": 0,
        "reasons": [
          "whole-file-preserves-sequential-state-and-hooks"
        ]
      },
      "provenance": {
        "source": "executed",
        "reason": "entry-not-found",
        "fingerprint": "afe88009413039775cf05bdb3d1a8d9f29cad142e2494856f3a3a25afbecc52c"
      }
    },
    {
      "id": "fc1599c4b0bb153a811ae53c50780024f29b0c571cd7108e189d9a52a86836bf",
      "file": "/root/oximut/.oximut/cache-scan-invalidation/measured-01-m1-oximut-incremental-source/project/src/subject.ts",
      "operator": "boolean-literal",
      "original": "true",
      "replacement": "false",
      "location": {
        "start": {
          "offset": 46,
          "line": 2,
          "column": 10
        },
        "end": {
          "offset": 50,
          "line": 2,
          "column": 14
        }
      },
      "outcome": "killed",
      "tests": {
        "passed": 1,
        "failed": 1,
        "skipped": 0
      },
      "errors": [
        "expected false to be true // Object.is equality"
      ],
      "selection": {
        "mode": "files",
        "files": [
          "/root/oximut/.oximut/cache-scan-invalidation/measured-01-m1-oximut-incremental-source/project/test/subject.test.ts"
        ],
        "selectedTests": 2,
        "totalTests": 2,
        "expectedSkipped": 0,
        "reasons": [
          "whole-file-preserves-sequential-state-and-hooks"
        ]
      },
      "provenance": {
        "source": "executed",
        "reason": "entry-not-found",
        "fingerprint": "afe88009413039775cf05bdb3d1a8d9f29cad142e2494856f3a3a25afbecc52c"
      }
    },
    {
      "id": "09e8f31b7ce318ba2093f75696585313846b37eb9f80f4b43d065cdb613efbdc",
      "file": "/root/oximut/.oximut/cache-scan-invalidation/measured-01-m1-oximut-incremental-source/project/src/subject.ts",
      "operator": "boolean-literal",
      "original": "false",
      "replacement": "true",
      "location": {
        "start": {
          "offset": 258,
          "line": 11,
          "column": 10
        },
        "end": {
          "offset": 263,
          "line": 11,
          "column": 15
        }
      },
      "outcome": "no-coverage",
      "tests": {
        "passed": 0,
        "failed": 0,
        "skipped": 0
      },
      "errors": [],
      "selection": {
        "mode": "none",
        "files": [],
        "selectedTests": 0,
        "totalTests": 2,
        "expectedSkipped": 0,
        "reasons": [
          "complete-baseline-without-hits"
        ]
      },
      "provenance": {
        "source": "baseline-coverage",
        "reason": "entry-not-found",
        "fingerprint": "afe88009413039775cf05bdb3d1a8d9f29cad142e2494856f3a3a25afbecc52c"
      }
    }
  ],
  "diagnostics": [
    "execution=persistent; isolation=fresh-test-forks; controller reuse only; baseline=original-and-disabled-switches",
    "disabled switching validation: /root/oximut/.oximut/cache-scan-invalidation/measured-01-m1-oximut-incremental-source/project/src/subject.ts: Passed",
    "adapter observed reuse boundary: controller"
  ],
  "summary": {
    "total": 3,
    "killed": 2,
    "survived": 0,
    "noCoverage": 1,
    "invalid": 0,
    "timeout": 0,
    "infrastructureError": 0,
    "resourceExhausted": 0,
    "skipped": 0,
    "scoreDenominator": 3,
    "score": 66.66666666666667,
    "complete": true
  },
  "cache": {
    "enabled": true,
    "outcomesEnabled": true,
    "fingerprint": "afe88009413039775cf05bdb3d1a8d9f29cad142e2494856f3a3a25afbecc52c",
    "reason": "entry-not-found",
    "instrumentationHits": 0,
    "instrumentationMisses": 1,
    "outcomeHits": 0,
    "outcomeMisses": 3,
    "persistence": "complete-run-staged-for-commit-after-report",
    "runnerHashMs": 34,
    "fingerprintProfiles": [
      {
        "phase": "prepare",
        "completed": true,
        "elapsedMs": 9170,
        "runtimeIdentityMs": 162,
        "resourcePolicyMs": 34,
        "inputsMs": 8973,
        "filesHashed": 10078,
        "bytesHashed": 294701271
      },
      {
        "phase": "pre-publication",
        "completed": true,
        "elapsedMs": 5136,
        "runtimeIdentityMs": 143,
        "resourcePolicyMs": 9,
        "inputsMs": 4984,
        "filesHashed": 10078,
        "bytesHashed": 294701271
      }
    ]
  },
  "resources": {
    "admissionPauses": 1,
    "admissionWorkerCostBytes": 315591680,
    "budgetBytes": 12115951616,
    "cgroups": [],
    "configuredBudgetBytes": null,
    "configuredWorkers": 1,
    "cpuLimitWorkers": 8,
    "effectiveWorkers": 1,
    "enforcement": "best-effort sampled admission and process-tree cancellation; existing cgroup limits are OS-enforced; no new hard cap installed",
    "exhaustion": null,
    "maxActiveJobs": 1,
    "measuredWorkerPeakBytes": 252473344,
    "measurement": "Linux /proc RSS sum: main CLI and all worker/adapter/controller/test descendants; shared pages counted per process",
    "peakAggregateRssBytes": 257552384,
    "recycledIdleWorkers": 0,
    "reserveBytes": 67108864,
    "sampleIntervalMs": 50,
    "samples": 139
  }
}
